{
  "id": "00000000-0000-4000-8000-000000000009",
  "schema_version": "1.0.0",
  "revision": 0,
  "status": "draft",
  "projectId": "00000000-0000-4000-8000-000000000001",
  "episodeId": "00000000-0000-4000-8000-000000000002",
  "cutId": "00000000-0000-4000-8000-00000000000a",
  "fps": 24,
  "width": 1920,
  "height": 1080,
  "tracks": [
    {
      "id": "00000000-0000-4000-8000-00000000000b",
      "kind": "video",
      "name": "Video 1"
    }
  ],
  "clips": [
    {
      "id": "00000000-0000-4000-8000-00000000000c",
      "trackId": "00000000-0000-4000-8000-00000000000b",
      "assetVersionId": "00000000-0000-4000-8000-000000000006",
      "timelineStartFrame": 0,
      "sourceInFrame": 0,
      "durationFrames": 48
    }
  ],
  "captions": []
}
